{
  "tag": "sushi-20250921-0215",
  "prompt": "00_bootstrap_flowgroup",
  "step": "step03_autogen",
  "timestamp": "2025-09-21T03:16:51Z",
  "status": "ok",
  "description": "evaluated autogen posture",
  "artifact": ".mfme/out/logs/autogen_status.txt",
  "checksum": "f68bf92d1862ed2a2d59abe90d6ea07f65217dbec6f4cdba553130705a43486f",
  "autogen": "dry_run"
}
