{
  "tag": "sushi-20250921-0215",
  "prompt": "00_bootstrap_flowgroup",
  "step": "step04_run_state",
  "timestamp": "2025-09-21T03:16:53Z",
  "status": "ok",
  "description": "initialized run state",
  "artifact": ".mfme/out/state/run.sushi-20250921-0215.json",
  "checksum": "8d7c03b7475a951ec828da4d238de424424058b9d3d714ce3a0a555ca6825c8d",
  "autogen": "dry_run"
}
